{
  "build": {
    "configure_flags": [
      "--sysconfdir=/etc",
      "--with-arch=${stdenv.hostPlatform.parsed.cpu.name}",
      "--with-cache-dir=/var/cache/fontconfig",
      "otherwise",
      "the",
      "fallback",
      "is",
      "in",
      "$out/",
      "just",
      "<1MB",
      "this",
      "is",
      "what",
      "you",
      "get",
      "when",
      "loading",
      "config",
      "fails",
      "for",
      "some",
      "reason",
      "--with-default-fonts=${dejavu_fonts.minimal}"
    ],
    "make_flags": [],
    "phases": [
      "configure",
      "build",
      "check",
      "install"
    ],
    "system_kind": "python"
  },
  "conflicts": [
    "linux-c6-${PORTNAME}",
    "linux-c7-${PORTNAME}"
  ],
  "dependencies": {
    "build": [
      "autoreconfHook",
      "gperf",
      "libxslt",
      "pkg-config",
      "python3",
      "autoreconf-hook",
      "pkg-config-wrapper",
      "version-check-hook"
    ],
    "host": [
      "expat",
      "freetype2",
      "expat2"
    ],
    "runtime": [
      "freetype",
      "expat"
    ],
    "test": []
  },
  "descriptive": {
    "categories": [],
    "homepage": "http://fontconfig.org/",
    "license": [
      "BSD-2-Clause"
    ],
    "maintainers": [
      "jtojnar",
      "desktop@FreeBSD.org",
      "emulation@FreeBSD.org"
    ],
    "summary": "Library for font customization and configuration"
  },
  "extensions": {
    "merged_from": [
      "freebsd_ports",
      "nixpkgs"
    ],
    "nixpkgs": {
      "attr": "fontconfig"
    }
  },
  "features": {},
  "identity": {
    "canonical_id": "pkg:fontconfig",
    "canonical_name": "fontconfig",
    "ecosystem": "nixpkgs",
    "ecosystem_id": "pkgs/development/libraries/fontconfig",
    "version": "2.18.3"
  },
  "patches": [],
  "platforms": {
    "exclude": [],
    "include": []
  },
  "provenance": {
    "confidence": 0.95,
    "generated_by": "refresh_recipes.py",
    "imported_at": "2026-10-08T14:14:08+00:00",
    "source_path": "pkgs/development/libraries/fontconfig/default.nix",
    "source_repo_commit": "58a05315926ecd06da72f932e16d36750591c6ac",
    "unmapped": [],
    "warnings": [
      "partial refresh; kept prior data for: freebsd_ports"
    ]
  },
  "schema_version": "0.2",
  "sources": [
    {
      "type": "homepage",
      "url": "http://fontconfig.org/"
    },
    {
      "type": "archive",
      "url": "https://gitlab.freedesktop.org/api/v4/projects/890/packages/generic/fontconfig/${finalAttrs.version}/fontconfig-${finalAttrs.version}.tar.xz"
    },
    {
      "type": "archive",
      "url": "https://gitlab.freedesktop.org/fontconfig/fontconfig.git"
    },
    {
      "type": "homepage",
      "url": "https://www.freedesktop.org/wiki/Software/fontconfig/"
    },
    {
      "type": "master_sites",
      "url": "https://gitlab.freedesktop.org/api/v4/projects/890/packages/generic/${PORTNAME}/${DISTVERSION}/"
    }
  ],
  "tests": {}
}
