{
  "build": {
    "configure_args": [],
    "make_args": [],
    "system_kind": "pypi"
  },
  "conflicts": [],
  "dependencies": {
    "build": [],
    "host": [],
    "runtime": [],
    "test": []
  },
  "descriptive": {
    "categories": [
      "python"
    ],
    "homepage": "https://networkx.org/",
    "license": [
      "BSD-3-Clause"
    ],
    "maintainers": [
      "NetworkX Developers <networkx-discuss@googlegroups.com>"
    ],
    "summary": "Python package for creating and manipulating graphs and networks"
  },
  "extensions": {
    "merged_from": [
      "pypi"
    ],
    "pypi": {
      "build_requirements_state": "unavailable_from_registry_metadata",
      "classifiers": [
        "Development Status :: 5 - Production/Stable",
        "Intended Audience :: Developers",
        "Intended Audience :: Science/Research",
        "Operating System :: OS Independent",
        "Programming Language :: Python :: 3",
        "Programming Language :: Python :: 3 :: Only",
        "Programming Language :: Python :: 3.12",
        "Programming Language :: Python :: 3.13",
        "Programming Language :: Python :: 3.14",
        "Programming Language :: Python :: 3.15"
      ],
      "license_expression": "BSD-3-Clause",
      "license_text": "",
      "requires_dist": [
        "asv>=0.6.5; extra == \"benchmarking\"",
        "py-rattler<0.22,>=0.21; extra == \"benchmarking\"",
        "virtualenv; extra == \"benchmarking\"",
        "numpy>=2.2; extra == \"default\"",
        "scipy>=1.15; extra == \"default\"",
        "matplotlib>=3.10; extra == \"default\"",
        "pandas>=2.3; extra == \"default\"",
        "pre-commit>=4.1; extra == \"developer\"",
        "mypy>=1.15; extra == \"developer\"",
        "sphinx>=8.0; extra == \"doc\"",
        "pydata-sphinx-theme>=0.16; extra == \"doc\"",
        "sphinx-gallery>=0.18; extra == \"doc\"",
        "numpydoc>=1.8.0; extra == \"doc\"",
        "pillow>=10; extra == \"doc\"",
        "texext>=0.6.7; extra == \"doc\"",
        "myst-nb>=1.1; extra == \"doc\"",
        "intersphinx-registry; extra == \"doc\"",
        "osmnx>=2.0.0; extra == \"example\"",
        "momepy>=0.7.2; extra == \"example\"",
        "contextily>=1.6; extra == \"example\"",
        "seaborn>=0.13; extra == \"example\"",
        "cairocffi>=1.7; extra == \"example\"",
        "igraph>=0.11; extra == \"example\"",
        "scikit-learn>=1.6; extra == \"example\"",
        "iplotx>=0.9.0; extra == \"example\"",
        "hiveplotlib>=0.28; extra == \"example\"",
        "lxml>=4.6; extra == \"extra\"",
        "pygraphviz>=2.0; extra == \"extra\"",
        "pydot>=3.0.1; extra == \"extra\"",
        "sympy>=1.10; extra == \"extra\"",
        "build>=0.10; extra == \"release\"",
        "twine>=4.0; extra == \"release\"",
        "wheel>=0.40; extra == \"release\"",
        "changelist==0.5; extra == \"release\"",
        "pytest>=7.2; extra == \"test\"",
        "pytest-cov>=4.0; extra == \"test\"",
        "pytest-xdist>=3.0; extra == \"test\"",
        "pytest-mpl; extra == \"test-extras\"",
        "pytest-randomly; extra == \"test-extras\""
      ],
      "requires_python": "!=3.14.1,>=3.12",
      "source_repository": "https://github.com/networkx/networkx"
    }
  },
  "features": {},
  "identity": {
    "canonical_id": "pkg:networkx",
    "canonical_name": "networkx",
    "ecosystem": "pypi",
    "ecosystem_id": "networkx",
    "version": "3.7"
  },
  "patches": [],
  "platforms": {
    "exclude": [],
    "include": []
  },
  "provenance": {
    "confidence": 0.9,
    "generated_by": "refresh_recipes.py",
    "imported_at": "2026-10-20T21:29:04+00:00",
    "source_path": "https://pypi.org/pypi/networkx/json",
    "source_repo_commit": null,
    "unmapped": [],
    "warnings": [
      "Build requirements are unavailable from PyPI JSON metadata; no build dependencies inferred."
    ]
  },
  "schema_version": "0.2",
  "sources": [
    {
      "sha256": "fd77a511bd90f39f3d016351345b52cf5319b813bdca01de3f755d3cca62e96a",
      "type": "sdist",
      "url": "https://files.pythonhosted.org/packages/dc/76/3af777226b63a5e64a6b36b1ec5855c14e2b94a37096d4760e595fc43511/networkx-3.7.tar.gz"
    }
  ],
  "tests": {}
}
