{
  "build": {
    "configure_args": [],
    "make_args": [],
    "system_kind": "npm"
  },
  "conflicts": [],
  "dependencies": {
    "build": [
      "nyc",
      "mocha",
      "eslint",
      "supertest",
      "eslint-plugin-node",
      "eslint-plugin-import",
      "eslint-plugin-promise",
      "eslint-config-standard",
      "eslint-plugin-markdown",
      "eslint-plugin-standard"
    ],
    "host": [],
    "runtime": [
      "qs",
      "bytes",
      "debug",
      "type-is",
      "raw-body",
      "iconv-lite",
      "http-errors",
      "on-finished",
      "content-type"
    ],
    "test": []
  },
  "descriptive": {
    "categories": [
      "javascript"
    ],
    "homepage": "https://github.com/expressjs/body-parser#readme",
    "license": [
      "MIT"
    ],
    "maintainers": [
      "doug@somethingdoug.com",
      "ulisesgascondev@gmail.com",
      "npm@jonchurch.com",
      "wes@wesleytodd.com"
    ],
    "summary": "Node.js body parsing middleware"
  },
  "extensions": {
    "merged_from": [
      "npm"
    ],
    "npm": {
      "engines": {
        "node": ">=18"
      },
      "keywords": [],
      "source_repository": "https://github.com/expressjs/body-parser"
    }
  },
  "features": {},
  "identity": {
    "canonical_id": "pkg:body-parser",
    "canonical_name": "body-parser",
    "ecosystem": "npm",
    "ecosystem_id": "body-parser",
    "version": "2.3.0"
  },
  "patches": [],
  "platforms": {
    "exclude": [],
    "include": []
  },
  "provenance": {
    "confidence": 0.85,
    "generated_by": "refresh_recipes.py",
    "imported_at": "2026-10-08T04:28:41+00:00",
    "source_path": "https://registry.npmjs.org/body-parser",
    "source_repo_commit": null,
    "unmapped": [],
    "warnings": []
  },
  "schema_version": "0.2",
  "sources": [
    {
      "integrity": "sha512-2cGmJupaNgg+QUwVLAucDuWuoMZ6EX9iHDRswZ5lsNYEmwPaRknMPCLZz07yTzVq/83p4o/wzbDZbBrTvGGTIw==",
      "type": "tarball",
      "url": "https://registry.npmjs.org/body-parser/-/body-parser-2.3.0.tgz"
    }
  ],
  "tests": {}
}
