{
  "build": {
    "configure_args": [],
    "make_args": [],
    "system_kind": "pypi"
  },
  "conflicts": [],
  "dependencies": {
    "build": [],
    "host": [],
    "runtime": [],
    "test": []
  },
  "descriptive": {
    "categories": [
      "python"
    ],
    "homepage": "https://pygments.org",
    "license": [
      "BSD-2-Clause"
    ],
    "maintainers": [
      "Georg Brandl <georg@python.org>",
      "Jean Abou Samra <jean@abou-samra.fr>"
    ],
    "summary": "Pygments is a syntax highlighting package written in Python."
  },
  "extensions": {
    "merged_from": [
      "pypi"
    ],
    "pypi": {
      "build_requirements_state": "unavailable_from_registry_metadata",
      "classifiers": [
        "Development Status :: 6 - Mature",
        "Intended Audience :: Developers",
        "Intended Audience :: End Users/Desktop",
        "Intended Audience :: System Administrators",
        "Operating System :: OS Independent",
        "Programming Language :: Python",
        "Programming Language :: Python :: 3",
        "Programming Language :: Python :: 3.10",
        "Programming Language :: Python :: 3.11",
        "Programming Language :: Python :: 3.12"
      ],
      "license_expression": "BSD-2-Clause",
      "license_text": "",
      "requires_dist": [
        "colorama>=0.4.6; extra == \"windows-terminal\""
      ],
      "requires_python": ">=3.9",
      "source_repository": "https://github.com/pygments/pygments"
    }
  },
  "features": {},
  "identity": {
    "canonical_id": "pkg:pygments",
    "canonical_name": "pygments",
    "ecosystem": "pypi",
    "ecosystem_id": "Pygments",
    "version": "2.21.0"
  },
  "patches": [],
  "platforms": {
    "exclude": [],
    "include": []
  },
  "provenance": {
    "confidence": 0.9,
    "generated_by": "refresh_recipes.py",
    "imported_at": "2026-10-20T21:29:06+00:00",
    "source_path": "https://pypi.org/pypi/Pygments/json",
    "source_repo_commit": null,
    "unmapped": [],
    "warnings": [
      "Build requirements are unavailable from PyPI JSON metadata; no build dependencies inferred."
    ]
  },
  "schema_version": "0.2",
  "sources": [
    {
      "sha256": "610ca751c9bc2492b38eb9a38a7fbc93edbbb2d7182edaf34e66ae493dee5c8c",
      "type": "sdist",
      "url": "https://files.pythonhosted.org/packages/49/2e/ced460408999b33da6b31b0021b0f37d329e202d4169aeb164493778f25b/pygments-2.21.0.tar.gz"
    }
  ],
  "tests": {}
}
