{
  "build": {
    "configure_args": [],
    "make_args": [],
    "system_kind": "pypi"
  },
  "conflicts": [],
  "dependencies": {
    "build": [],
    "host": [],
    "runtime": [],
    "test": []
  },
  "descriptive": {
    "categories": [
      "python"
    ],
    "homepage": "http://github.com/fonttools/fonttools",
    "license": [
      "MIT"
    ],
    "maintainers": [
      "behdad@behdad.org"
    ],
    "summary": "Tools to manipulate font files"
  },
  "extensions": {
    "merged_from": [
      "pypi"
    ],
    "pypi": {
      "build_requirements_state": "unavailable_from_registry_metadata",
      "classifiers": [
        "Development Status :: 5 - Production/Stable",
        "Environment :: Console",
        "Environment :: Other Environment",
        "Intended Audience :: Developers",
        "Intended Audience :: End Users/Desktop",
        "Natural Language :: English",
        "Operating System :: OS Independent",
        "Programming Language :: Python",
        "Programming Language :: Python :: 3",
        "Programming Language :: Python :: 3.11"
      ],
      "license_expression": "",
      "license_text": "MIT",
      "requires_dist": [
        "lxml>=4.0; extra == \"lxml\"",
        "brotli>=1.0.1; platform_python_implementation == \"CPython\" and extra == \"woff\"",
        "brotlicffi>=0.8.0; platform_python_implementation != \"CPython\" and extra == \"woff\"",
        "zopfli>=0.1.4; extra == \"woff\"",
        "unicodedata2>=18.0.0; python_version <= \"3.15\" and extra == \"unicode\"",
        "lz4>=1.7.4.2; extra == \"graphite\"",
        "scipy; platform_python_implementation != \"PyPy\" and extra == \"interpolatable\"",
        "munkres; platform_python_implementation == \"PyPy\" and extra == \"interpolatable\"",
        "pycairo; extra == \"interpolatable\"",
        "matplotlib; extra == \"plot\"",
        "sympy; extra == \"symfont\"",
        "xattr; sys_platform == \"darwin\" and extra == \"type1\"",
        "skia-pathops>=0.5.0; extra == \"pathops\"",
        "uharfbuzz>=0.45.0; extra == \"repacker\"",
        "lxml>=4.0; extra == \"all\"",
        "brotli>=1.0.1; platform_python_implementation == \"CPython\" and extra == \"all\"",
        "brotlicffi>=0.8.0; platform_python_implementation != \"CPython\" and extra == \"all\"",
        "zopfli>=0.1.4; extra == \"all\"",
        "unicodedata2>=18.0.0; python_version <= \"3.15\" and extra == \"all\"",
        "lz4>=1.7.4.2; extra == \"all\"",
        "scipy; platform_python_implementation != \"PyPy\" and extra == \"all\"",
        "munkres; platform_python_implementation == \"PyPy\" and extra == \"all\"",
        "pycairo; extra == \"all\"",
        "matplotlib; extra == \"all\"",
        "sympy; extra == \"all\"",
        "xattr; sys_platform == \"darwin\" and extra == \"all\"",
        "skia-pathops>=0.5.0; extra == \"all\"",
        "uharfbuzz>=0.45.0; extra == \"all\""
      ],
      "requires_python": ">=3.11",
      "source_repository": "https://github.com/fonttools/fonttools"
    }
  },
  "features": {},
  "identity": {
    "canonical_id": "pkg:fonttools",
    "canonical_name": "fonttools",
    "ecosystem": "pypi",
    "ecosystem_id": "fonttools",
    "version": "4.67.0"
  },
  "patches": [],
  "platforms": {
    "exclude": [],
    "include": []
  },
  "provenance": {
    "confidence": 0.9,
    "generated_by": "refresh_recipes.py",
    "imported_at": "2026-10-20T21:29:03+00:00",
    "source_path": "https://pypi.org/pypi/fonttools/json",
    "source_repo_commit": null,
    "unmapped": [],
    "warnings": [
      "Build requirements are unavailable from PyPI JSON metadata; no build dependencies inferred."
    ]
  },
  "schema_version": "0.2",
  "sources": [
    {
      "sha256": "3cb57e6600ca77c0b1729cf8adc23bc0652633a37f18cfa934d9c7bc3de25519",
      "type": "sdist",
      "url": "https://files.pythonhosted.org/packages/94/36/102e180f8f5dbaee88b26595b01ca8aa80bf4e62128d9aa94265b3996c96/fonttools-4.67.0.tar.gz"
    }
  ],
  "tests": {}
}
