{
  "build": {
    "configure_args": [],
    "make_args": [],
    "system_kind": "freebsd_ports_make",
    "uses": [
      "cpe",
      "linux"
    ]
  },
  "conflicts": [
    "${LUA_PKGNAMEPREFIX}lzlib",
    "#",
    "lib/lua/5.*/zlib.so"
  ],
  "dependencies": {
    "build": [],
    "host": [],
    "runtime": [],
    "test": []
  },
  "descriptive": {
    "categories": [
      "devel",
      "linux"
    ],
    "deprecated": false,
    "homepage": "http://zlib.net/",
    "license": [
      "ZLIB"
    ],
    "maintainers": [
      "emulation@FreeBSD.org",
      "sirl33tname@gmail.com",
      "sunpoet@FreeBSD.org",
      "balsoft",
      "infinisil",
      "pyrox0"
    ],
    "summary": "Zlib headers (Linux CentOS ${LINUX_DIST_VER})"
  },
  "extensions": {
    "freebsd_ports": {
      "raw_vars": {
        "CATEGORIES": "devel linux",
        "PORTNAME": "zlib"
      }
    },
    "merged_from": [
      "freebsd_ports",
      "nixpkgs"
    ]
  },
  "features": {
    "options_define": [
      "DOCS"
    ]
  },
  "identity": {
    "canonical_id": "pkg:zlib",
    "canonical_name": "zlib",
    "ecosystem": "freebsd_ports",
    "ecosystem_id": "devel/linux-c7-zlib-devel",
    "version": "1.2.7"
  },
  "patches": [],
  "platforms": {
    "exclude": [],
    "include": []
  },
  "provenance": {
    "confidence": 0.95,
    "generated_by": "refresh_recipes.py",
    "imported_at": "2026-10-08T04:28:54+00:00",
    "source_path": "devel/linux-c7-zlib-devel",
    "source_repo_commit": "7e6eb47aa71100bc6278d613df0743e2b1ddeaaf",
    "unmapped": [],
    "warnings": [
      "partial refresh; kept prior data for: nixpkgs"
    ]
  },
  "schema_version": "0.2",
  "sources": [
    {
      "type": "homepage",
      "url": "http://zlib.net/"
    },
    {
      "type": "homepage",
      "url": "https://github.com/brimworks/lua-zlib"
    },
    {
      "type": "homepage",
      "url": "https://github.com/ruby/zlib"
    },
    {
      "type": "master_sites",
      "url": "RG"
    },
    {
      "type": "homepage",
      "url": "https://zlib.net"
    }
  ],
  "tests": {}
}
