{
  "build": {
    "configure_args": [],
    "make_args": [],
    "system_kind": "freebsd_ports_make",
    "uses": [
      "gem",
      "gnome"
    ]
  },
  "conflicts": [],
  "dependencies": {
    "build": [
      "docutils",
      "for",
      "rst2man,",
      "rst2html5",
      "gettext",
      "gobject-introspection",
      "makeWrapper",
      "meson",
      "ninja",
      "pkg-config",
      "python3",
      "sassc",
      "gi-docgen",
      "libxml2",
      "xmllint",
      "shared-mime-info"
    ],
    "host": [
      "libxkbcommon",
      "libpng",
      "libtiff",
      "libjpeg",
      "override",
      "{",
      "inherit",
      "x11Support",
      "})",
      "isocodes"
    ],
    "runtime": [
      "rubygem-atk",
      "rubygem-gdk4",
      "rubygem-gsk4",
      "Required",
      "by",
      "pkg-config",
      "",
      "cairo",
      "gdk-pixbuf",
      "glib",
      "graphene",
      "pango"
    ],
    "test": []
  },
  "descriptive": {
    "categories": [
      "x11-toolkits",
      "rubygems"
    ],
    "deprecated": false,
    "homepage": "https://ruby-gnome.github.io/  \t\thttps://github.com/ruby-gnome/ruby-gnome",
    "license": [
      "LGPL21+",
      "lgpl2Plus"
    ],
    "maintainers": [
      "sunpoet@FreeBSD.org"
    ],
    "summary": "Ruby binding of GTK 4"
  },
  "extensions": {
    "freebsd_ports": {
      "raw_vars": {
        "CATEGORIES": "x11-toolkits rubygems",
        "PORTNAME": "gtk4"
      }
    },
    "merged_from": [
      "freebsd_ports",
      "nixpkgs"
    ],
    "nixpkgs": {
      "recipe_file": "package.nix"
    }
  },
  "features": {},
  "identity": {
    "canonical_id": "pkg:gtk4",
    "canonical_name": "gtk4",
    "ecosystem": "freebsd_ports",
    "ecosystem_id": "x11-toolkits/rubygem-gtk4",
    "version": "4.3.9"
  },
  "patches": [],
  "platforms": {
    "exclude": [],
    "include": []
  },
  "provenance": {
    "confidence": 0.95,
    "generated_by": "refresh_recipes.py",
    "imported_at": "2026-10-08T04:28:44+00:00",
    "source_path": "x11-toolkits/rubygem-gtk4",
    "source_paths": [
      "x11-toolkits/rubygem-gtk4",
      "pkgs/by-name/gt/gtk4/package.nix"
    ],
    "source_repo_commit": null,
    "source_repo_commits": [
      "7e6eb47aa71100bc6278d613df0743e2b1ddeaaf",
      "144baa99f5e19735361b0be3cb11f7d6ef251dcc"
    ],
    "unmapped": [],
    "warnings": []
  },
  "schema_version": "0.2",
  "sources": [
    {
      "type": "homepage",
      "url": "https://ruby-gnome.github.io/  \t\thttps://github.com/ruby-gnome/ruby-gnome"
    },
    {
      "type": "master_sites",
      "url": "RG"
    },
    {
      "type": "homepage",
      "url": "https://www.gtk.org/"
    },
    {
      "type": "archive",
      "url": "mirror://gnome/sources/gtk/${lib.versions.majorMinor finalAttrs.version}/gtk-${finalAttrs.version}.tar.xz"
    },
    {
      "type": "archive",
      "url": "https://gitlab.gnome.org/GNOME/gtk/-/commit/10d43de8f4f942cb591ada3103474bd7213425f1.patch"
    },
    {
      "type": "archive",
      "url": "https://gitlab.gnome.org/GNOME/gtk/-/commit/221cd8e1904f2ca35d89dff3c1068616c6ce588c.patch"
    }
  ],
  "tests": {}
}
