{
  "build": {
    "configure_args": [],
    "make_args": [],
    "system_kind": "pypi"
  },
  "conflicts": [],
  "dependencies": {
    "build": [],
    "host": [],
    "runtime": [],
    "test": []
  },
  "descriptive": {
    "categories": [
      "python"
    ],
    "homepage": "https://packaging.pypa.io/",
    "license": [
      "Apache-2.0 OR BSD-2-Clause"
    ],
    "maintainers": [
      "Donald Stufft <donald@stufft.io>"
    ],
    "summary": "Core utilities for Python packages"
  },
  "extensions": {
    "merged_from": [
      "pypi"
    ],
    "pypi": {
      "build_requirements_state": "unavailable_from_registry_metadata",
      "classifiers": [
        "Development Status :: 5 - Production/Stable",
        "Intended Audience :: Developers",
        "Programming Language :: Python",
        "Programming Language :: Python :: 3",
        "Programming Language :: Python :: 3 :: Only",
        "Programming Language :: Python :: 3.10",
        "Programming Language :: Python :: 3.11",
        "Programming Language :: Python :: 3.12",
        "Programming Language :: Python :: 3.13",
        "Programming Language :: Python :: 3.14"
      ],
      "license_expression": "Apache-2.0 OR BSD-2-Clause",
      "license_text": "",
      "requires_dist": [],
      "requires_python": ">=3.9",
      "source_repository": "https://github.com/pypa/packaging"
    }
  },
  "features": {},
  "identity": {
    "canonical_id": "pkg:packaging",
    "canonical_name": "packaging",
    "ecosystem": "pypi",
    "ecosystem_id": "packaging",
    "version": "26.3"
  },
  "patches": [],
  "platforms": {
    "exclude": [],
    "include": []
  },
  "provenance": {
    "confidence": 0.9,
    "generated_by": "refresh_recipes.py",
    "imported_at": "2026-10-20T21:29:05+00:00",
    "source_path": "https://pypi.org/pypi/packaging/json",
    "source_repo_commit": null,
    "unmapped": [],
    "warnings": [
      "Build requirements are unavailable from PyPI JSON metadata; no build dependencies inferred."
    ]
  },
  "schema_version": "0.2",
  "sources": [
    {
      "sha256": "94edc256424af38762eb31306eed28beb9f0efc50a8837492c9d6fd6004aed79",
      "type": "sdist",
      "url": "https://files.pythonhosted.org/packages/7d/fa/3944b40b07da9ce895c0e6303a5ab7d53da063554f534556b134a54d6093/packaging-26.3.tar.gz"
    }
  ],
  "tests": {}
}
