{
  "build": {
    "configure_args": [],
    "make_args": [],
    "system_kind": "pypi"
  },
  "conflicts": [],
  "dependencies": {
    "build": [],
    "host": [],
    "runtime": [
      "setuptools"
    ],
    "test": []
  },
  "descriptive": {
    "categories": [
      "python"
    ],
    "homepage": "https://docs.openstack.org/pbr/latest/",
    "license": [
      "Apache-2.0"
    ],
    "maintainers": [
      "openstack-discuss@lists.openstack.org"
    ],
    "summary": "Python Build Reasonableness"
  },
  "extensions": {
    "merged_from": [
      "pypi"
    ],
    "pypi": {
      "build_requirements_state": "unavailable_from_registry_metadata",
      "classifiers": [
        "Development Status :: 5 - Production/Stable",
        "Environment :: Console",
        "Environment :: OpenStack",
        "Intended Audience :: Developers",
        "Intended Audience :: Information Technology",
        "Operating System :: OS Independent",
        "Programming Language :: Python",
        "Programming Language :: Python :: 2",
        "Programming Language :: Python :: 2.7",
        "Programming Language :: Python :: 3"
      ],
      "license_expression": "",
      "license_text": "Apache-2.0",
      "requires_dist": [
        "setuptools"
      ],
      "requires_python": ">=2.6",
      "source_repository": "https://opendev.org/openstack/pbr"
    }
  },
  "features": {},
  "identity": {
    "canonical_id": "pkg:pbr",
    "canonical_name": "pbr",
    "ecosystem": "pypi",
    "ecosystem_id": "pbr",
    "version": "7.1.3"
  },
  "patches": [],
  "platforms": {
    "exclude": [],
    "include": []
  },
  "provenance": {
    "confidence": 0.9,
    "generated_by": "refresh_recipes.py",
    "imported_at": "2026-10-20T21:29:05+00:00",
    "source_path": "https://pypi.org/pypi/pbr/json",
    "source_repo_commit": null,
    "unmapped": [],
    "warnings": [
      "Build requirements are unavailable from PyPI JSON metadata; no build dependencies inferred."
    ]
  },
  "schema_version": "0.2",
  "sources": [
    {
      "sha256": "9a4a85b84e906337708009af0b5f5cdabeeb72d4dc213c9e97974da54fd9acc5",
      "type": "sdist",
      "url": "https://files.pythonhosted.org/packages/6b/8d/ce438c28c7958e33184e8ac851ea2225b47a41e5e9e708fa3bddba631135/pbr-7.1.3.tar.gz"
    }
  ],
  "tests": {}
}
