{
  "build": {
    "configure_args": [],
    "make_args": [],
    "system_kind": "freebsd_ports_make",
    "uses": [
      "cpe",
      "linux"
    ]
  },
  "conflicts": [
    "${PORTNAME}${LLVM_SUFFIX}",
    "${PORTNAME}${LLVM_SUFFIX}-lite",
    "cling",
    "zapcc"
  ],
  "dependencies": {
    "build": [
      "binutils"
    ],
    "host": [
      "zstd"
    ],
    "runtime": [
      "llvm"
    ],
    "test": []
  },
  "descriptive": {
    "categories": [
      "devel",
      "linux"
    ],
    "deprecated": false,
    "homepage": "http://llvm.org",
    "license": [
      "GPLv2+"
    ],
    "maintainers": [
      "emulation@FreeBSD.org",
      "brooks@FreeBSD.org",
      "RossComputerGuy",
      "alyssais",
      "Ericson2314",
      "emilazy",
      "rrbutani",
      "sternenseemann",
      "balsoft",
      "infinisil",
      "pyrox0"
    ],
    "summary": "The Low Level Virtual Machine suite (Rocky Linux ${LINUX_DIST_VER})"
  },
  "extensions": {
    "freebsd_ports": {
      "raw_vars": {
        "CATEGORIES": "devel linux",
        "PORTNAME": "llvm"
      }
    },
    "merged_from": [
      "freebsd_ports",
      "nixpkgs"
    ]
  },
  "features": {},
  "identity": {
    "canonical_id": "pkg:llvm",
    "canonical_name": "llvm",
    "ecosystem": "freebsd_ports",
    "ecosystem_id": "devel/linux-rl9-llvm",
    "version": "21.1.8"
  },
  "patches": [],
  "platforms": {
    "exclude": [],
    "include": []
  },
  "provenance": {
    "confidence": 0.95,
    "generated_by": "refresh_recipes.py",
    "imported_at": "2026-10-08T14:14:11+00:00",
    "source_path": "devel/linux-rl9-llvm",
    "source_repo_commit": "e590e1547696a5c9b5c0bf1eeafa8eaf50d4ffd8",
    "unmapped": [],
    "warnings": [
      "partial refresh; kept prior data for: nixpkgs"
    ]
  },
  "schema_version": "0.2",
  "sources": [
    {
      "type": "homepage",
      "url": "http://llvm.org"
    },
    {
      "type": "homepage",
      "url": "https://cheri-cpu.org"
    },
    {
      "type": "homepage",
      "url": "https://cheriot.org"
    },
    {
      "type": "homepage",
      "url": "https://llvm.org/"
    },
    {
      "type": "homepage",
      "url": "https://git.morello-project.org/morello/llvm-project"
    },
    {
      "type": "master_sites",
      "url": "#"
    },
    {
      "type": "master_sites",
      "url": "https://github.com/llvm/llvm-project/releases/download/llvmorg-${DISTVERSION:S/rc/-rc/}/"
    },
    {
      "type": "master_sites",
      "url": "https://github.com/llvm/llvm-project/releases/download/llvmorg-${DISTVERSION}/"
    }
  ],
  "tests": {}
}
