{
  "build": {
    "configure_args": [],
    "make_args": [],
    "system_kind": "pypi"
  },
  "conflicts": [],
  "dependencies": {
    "build": [],
    "host": [],
    "runtime": [
      "pyasn1-modules",
      "cryptography"
    ],
    "test": []
  },
  "descriptive": {
    "categories": [
      "python"
    ],
    "homepage": "https://github.com/googleapis/google-cloud-python/tree/main/packages/google-auth",
    "license": [
      "Apache 2.0"
    ],
    "maintainers": [
      "googleapis-packages@google.com"
    ],
    "summary": "Google Authentication Library"
  },
  "extensions": {
    "merged_from": [
      "pypi"
    ],
    "pypi": {
      "build_requirements_state": "unavailable_from_registry_metadata",
      "classifiers": [
        "Development Status :: 5 - Production/Stable",
        "Intended Audience :: Developers",
        "License :: OSI Approved :: Apache Software License",
        "Operating System :: MacOS :: MacOS X",
        "Operating System :: Microsoft :: Windows",
        "Operating System :: OS Independent",
        "Operating System :: POSIX",
        "Programming Language :: Python :: 3",
        "Programming Language :: Python :: 3.10",
        "Programming Language :: Python :: 3.11"
      ],
      "license_expression": "",
      "license_text": "Apache 2.0",
      "requires_dist": [
        "pyasn1-modules>=0.2.1",
        "cryptography>=38.0.3; python_version < \"3.14\"",
        "cryptography>=41.0.5; python_version >= \"3.14\"",
        "cryptography>=38.0.3; python_version < \"3.14\" and extra == \"cryptography\"",
        "cryptography>=41.0.5; python_version >= \"3.14\" and extra == \"cryptography\"",
        "cryptography>=38.0.3; python_version < \"3.14\" and extra == \"pyopenssl\"",
        "cryptography>=41.0.5; python_version >= \"3.14\" and extra == \"pyopenssl\"",
        "aiohttp<4.0.0,>=3.8.0; python_version < \"3.14\" and extra == \"aiohttp\"",
        "aiohttp<4.0.0,>=3.9.0; python_version >= \"3.14\" and extra == \"aiohttp\"",
        "requests<3.0.0,>=2.30.0; extra == \"aiohttp\"",
        "cryptography>=38.0.3; python_version < \"3.14\" and extra == \"enterprise-cert\"",
        "cryptography>=41.0.5; python_version >= \"3.14\" and extra == \"enterprise-cert\"",
        "pyjwt>=2.0; extra == \"pyjwt\"",
        "pyu2f>=0.1.5; extra == \"reauth\"",
        "requests<3.0.0,>=2.30.0; extra == \"requests\"",
        "grpcio<2.0.0,>=1.59.0; python_version < \"3.14\" and extra == \"testing\"",
        "grpcio<2.0.0,>=1.75.1; python_version >= \"3.14\" and extra == \"testing\"",
        "flask; extra == \"testing\"",
        "freezegun; extra == \"testing\"",
        "pyjwt>=2.0; extra == \"testing\"",
        "pytest; extra == \"testing\"",
        "pytest-cov; extra == \"testing\"",
        "pytest-localserver; extra == \"testing\"",
        "pyu2f>=0.1.5; extra == \"testing\"",
        "responses; extra == \"testing\"",
        "urllib3<3.0.0,>=1.26.15; extra == \"testing\"",
        "packaging>=20.0; extra == \"testing\"",
        "aiohttp<4.0.0,>=3.8.0; python_version < \"3.14\" and extra == \"testing\"",
        "aiohttp<4.0.0,>=3.9.0; python_version >= \"3.14\" and extra == \"testing\"",
        "requests<3.0.0,>=2.30.0; extra == \"testing\"",
        "aioresponses; extra == \"testing\"",
        "pytest-asyncio; extra == \"testing\"",
        "urllib3<3.0.0,>=1.26.15; extra == \"urllib3\"",
        "packaging>=20.0; extra == \"urllib3\"",
        "grpcio<2.0.0,>=1.59.0; python_version < \"3.14\" and extra == \"grpc\"",
        "grpcio<2.0.0,>=1.75.1; python_version >= \"3.14\" and extra == \"grpc\""
      ],
      "requires_python": ">=3.10",
      "source_repository": "https://github.com/googleapis/google-cloud-python"
    }
  },
  "features": {},
  "identity": {
    "canonical_id": "pkg:google-auth",
    "canonical_name": "google-auth",
    "ecosystem": "pypi",
    "ecosystem_id": "google-auth",
    "version": "2.62.0"
  },
  "patches": [],
  "platforms": {
    "exclude": [],
    "include": []
  },
  "provenance": {
    "confidence": 0.9,
    "generated_by": "refresh_recipes.py",
    "imported_at": "2026-10-20T21:29:03+00:00",
    "source_path": "https://pypi.org/pypi/google-auth/json",
    "source_repo_commit": null,
    "unmapped": [],
    "warnings": [
      "Build requirements are unavailable from PyPI JSON metadata; no build dependencies inferred."
    ]
  },
  "schema_version": "0.2",
  "sources": [
    {
      "sha256": "0bef0ce54bdf9ce226c5d66e4264413bd918141c31bbe49fb52eac882f513d69",
      "type": "sdist",
      "url": "https://files.pythonhosted.org/packages/f5/b9/4b2528f30114b106e3c3a7298ba38d85e682fd1f83fe7c4a5b77c7677082/google_auth-2.62.0.tar.gz"
    }
  ],
  "tests": {}
}
