{
  "build": {
    "configure_args": [],
    "make_args": [],
    "system_kind": "pypi"
  },
  "conflicts": [],
  "dependencies": {
    "build": [
      "setuptools",
      "wheel"
    ],
    "host": [],
    "runtime": [],
    "test": []
  },
  "descriptive": {
    "categories": [
      "python"
    ],
    "homepage": "https://blinker.readthedocs.io",
    "license": [],
    "maintainers": [
      "Pallets Ecosystem <contact@palletsprojects.com>"
    ],
    "summary": "Fast, simple object-to-object and broadcast signaling"
  },
  "extensions": {
    "pypi": {
      "classifiers": [
        "Development Status :: 5 - Production/Stable",
        "License :: OSI Approved :: MIT License",
        "Programming Language :: Python",
        "Typing :: Typed"
      ],
      "requires_python": ">=3.9",
      "source_repository": "https://github.com/pallets-eco/blinker"
    }
  },
  "features": {},
  "identity": {
    "canonical_id": "pkg:blinker",
    "canonical_name": "blinker",
    "ecosystem": "pypi",
    "ecosystem_id": "blinker",
    "version": "1.9.0"
  },
  "patches": [],
  "platforms": {
    "exclude": [],
    "include": []
  },
  "provenance": {
    "confidence": 0.9,
    "generated_by": "bootstrap_canonical_recipes.py",
    "imported_at": "2026-10-20T20:56:39+00:00",
    "source_path": "https://pypi.org/pypi/blinker/json",
    "source_repo_commit": null,
    "unmapped": [],
    "warnings": []
  },
  "schema_version": "0.2",
  "sources": [
    {
      "sha256": "b4ce2265a7abece45e7cc896e98dbebe6cead56bcf805a3d23136d145f5445bf",
      "type": "sdist",
      "url": "https://files.pythonhosted.org/packages/21/28/9b3f50ce0e048515135495f198351908d99540d69bfdc8c1d15b73dc55ce/blinker-1.9.0.tar.gz"
    }
  ],
  "tests": {}
}
