{
  "build": {
    "configure_args": [],
    "make_args": [],
    "system_kind": "freebsd_ports_make",
    "uses": [
      "cpe",
      "linux"
    ]
  },
  "conflicts": [
    "linux-c6-${PORTNAME}"
  ],
  "dependencies": {
    "build": [],
    "host": [],
    "runtime": [],
    "test": []
  },
  "descriptive": {
    "categories": [
      "security",
      "linux"
    ],
    "deprecated": false,
    "homepage": "https://www.gnupg.org/software/libgcrypt/index.html",
    "license": [
      "LGPL21+"
    ],
    "maintainers": [
      "emulation@FreeBSD.org"
    ],
    "summary": "Crypto library based on code used in GnuPG (Linux CentOS ${LINUX_DIST_VER})"
  },
  "extensions": {
    "freebsd_ports": {
      "raw_vars": {
        "CATEGORIES": "security linux",
        "PORTNAME": "libgcrypt"
      }
    },
    "merged_from": [
      "freebsd_ports"
    ]
  },
  "features": {
    "options_define": [
      "DOCS"
    ]
  },
  "identity": {
    "canonical_id": "pkg:libgcrypt",
    "canonical_name": "libgcrypt",
    "ecosystem": "freebsd_ports",
    "ecosystem_id": "security/linux-c7-libgcrypt",
    "version": "1.5.3"
  },
  "patches": [],
  "platforms": {
    "exclude": [],
    "include": []
  },
  "provenance": {
    "confidence": 0.95,
    "generated_by": "refresh_recipes.py",
    "imported_at": "2026-10-08T04:28:45+00:00",
    "source_path": "security/linux-c7-libgcrypt",
    "source_repo_commit": "7e6eb47aa71100bc6278d613df0743e2b1ddeaaf",
    "unmapped": [],
    "warnings": []
  },
  "schema_version": "0.2",
  "sources": [
    {
      "type": "homepage",
      "url": "https://www.gnupg.org/software/libgcrypt/index.html"
    }
  ],
  "tests": {}
}
