{
  "build": {
    "configure_flags": [],
    "make_flags": [],
    "phases": [
      "configure",
      "build",
      "check",
      "install"
    ],
    "system_kind": "cmake"
  },
  "conflicts": [],
  "dependencies": {
    "build": [],
    "host": [
      "with-env",
      "cctools"
    ],
    "runtime": [
      "dieHook"
    ],
    "test": []
  },
  "descriptive": {
    "categories": [],
    "homepage": "https://github.com/NixOS/nixpkgs/blob/master/pkgs/build-support/setup-hooks/auto-patchelf.sh",
    "license": [
      "MIT",
      "MIT",
      "MIT",
      "MIT",
      "MIT",
      "MIT",
      "MIT",
      "MIT",
      "MIT",
      "MIT",
      "MIT",
      "MIT",
      "MIT",
      "MIT",
      "MIT",
      "MIT",
      "MIT",
      "MIT",
      "MIT",
      "MIT",
      "MIT",
      "MIT"
    ],
    "maintainers": [],
    "summary": "Utility which reads and writes data across network connections \u2014 LibreSSL implementation"
  },
  "extensions": {
    "merged_from": [
      "nixpkgs"
    ],
    "nixpkgs": {
      "recipe_file": "all-packages.nix"
    }
  },
  "features": {},
  "identity": {
    "canonical_id": "pkg:auto-patchelf-hook",
    "canonical_name": "auto-patchelf-hook",
    "ecosystem": "nixpkgs",
    "ecosystem_id": "pkgs/top-level",
    "version": "2.9.3"
  },
  "patches": [],
  "platforms": {
    "exclude": [],
    "include": []
  },
  "provenance": {
    "confidence": 0.88,
    "generated_by": "refresh_recipes.py",
    "imported_at": "2026-10-08T04:28:40+00:00",
    "source_path": "pkgs/top-level/all-packages.nix",
    "source_repo_commit": "144baa99f5e19735361b0be3cb11f7d6ef251dcc",
    "unmapped": [
      "homepage"
    ],
    "warnings": []
  },
  "schema_version": "0.2",
  "sources": [
    {
      "type": "archive",
      "url": "https://git.dev.opencascade.org/gitweb/?p=occt.git;a=snapshot;h=${commit};sf=tgz"
    }
  ],
  "tests": {
    "has_check_phase": true
  }
}
