{
  "build": {
    "configure_args": [],
    "make_args": [],
    "system_kind": "npm"
  },
  "conflicts": [],
  "dependencies": {
    "build": [
      "@types/envinfo"
    ],
    "host": [
      "toml",
      "json5",
      "js-yaml",
      "webpack",
      "webpack-dev-server",
      "webpack-bundle-analyzer"
    ],
    "runtime": [
      "envinfo",
      "rechoir",
      "commander",
      "interpret",
      "cross-spawn",
      "import-local",
      "webpack-merge",
      "@discoveryjs/json-ext"
    ],
    "test": []
  },
  "descriptive": {
    "categories": [
      "javascript"
    ],
    "homepage": "https://github.com/webpack/webpack-cli/tree/main/packages/webpack-cli",
    "license": [
      "MIT"
    ],
    "maintainers": [
      "sheo13666q@gmail.com",
      "784487301@qq.com",
      "evenstensberg@gmail.com",
      "haijie0619@gmail.com",
      "tobias.koppers@googlemail.com",
      "me@aviv.sh"
    ],
    "summary": "CLI for webpack & friends"
  },
  "extensions": {
    "npm": {
      "engines": {
        "node": ">=20.9.0"
      },
      "keywords": [
        "webpack",
        "cli",
        "scaffolding",
        "module",
        "bundler",
        "web"
      ],
      "source_repository": "https://github.com/webpack/webpack-cli"
    }
  },
  "features": {},
  "identity": {
    "canonical_id": "pkg:webpack-cli",
    "canonical_name": "webpack-cli",
    "ecosystem": "npm",
    "ecosystem_id": "webpack-cli",
    "version": "7.2.3"
  },
  "patches": [],
  "platforms": {
    "exclude": [],
    "include": []
  },
  "provenance": {
    "confidence": 0.85,
    "generated_by": "bootstrap_canonical_recipes.py",
    "imported_at": "2026-10-20T20:57:04+00:00",
    "source_path": "https://registry.npmjs.org/webpack-cli",
    "source_repo_commit": null,
    "unmapped": [],
    "warnings": []
  },
  "schema_version": "0.2",
  "sources": [
    {
      "integrity": "sha512-vDFU7jrfCctnN7jJQWPl+V26B51GLp11prVZXg50oeonsgeBzSTJEWmXkjHsOjTgMjlPOQM8GWLh33X9RN/0ow==",
      "type": "tarball",
      "url": "https://registry.npmjs.org/webpack-cli/-/webpack-cli-7.2.3.tgz"
    }
  ],
  "tests": {}
}
