{
  "schema_version": "0.2",
  "stub": false,
  "identity": {
    "canonical_id": "pkg:zlib",
    "canonical_name": "zlib",
    "ecosystem": "nixpkgs",
    "ecosystem_id": "zlib",
    "version": "1.3.2"
  },
  "descriptive": {
    "summary": "Lossless data-compression library",
    "homepage": "https://www.zlib.net/",
    "license": ["Zlib"],
    "categories": [],
    "maintainers": [],
    "deprecated": false,
    "expiration_date": ""
  },
  "conflicts": [],
  "sources": [
    {
      "type": "archive",
      "url": "https://github.com/madler/zlib/releases/download/v1.3.2/zlib-1.3.2.tar.gz",
      "filename": "zlib-1.3.2.tar.gz",
      "sha256": "sha256-uzKaCizQJ00FUZ1hxmfAYuBpkNcuEl7i36jeZPARnRY="
    }
  ],
  "dependencies": {
    "build": [],
    "host": [],
    "runtime": [],
    "test": []
  },
  "build": {
    "system_kind": "autotools",
    "uses": [],
    "configure_args": [],
    "make_args": []
  },
  "features": {},
  "platforms": {"include": [], "exclude": []},
  "patches": [],
  "tests": {},
  "provenance": {
    "generated_by": "manual",
    "imported_at": "2026-03-28T00:00:00+00:00",
    "source_path": "zlib",
    "source_repo_commit": null,
    "confidence": 0.99,
    "unmapped": [],
    "warnings": []
  },
  "extensions": {
    "nixpkgs": {"attr": "zlib"}
  }
}
