{
  "build": {
    "configure_flags": [],
    "make_flags": [],
    "phases": [
      "configure",
      "build",
      "check",
      "install"
    ],
    "system_kind": "autotools"
  },
  "conflicts": [],
  "dependencies": {
    "build": [
      "pkg-config"
    ],
    "host": [
      "libx11",
      "xorgproto"
    ],
    "runtime": [
      "xorgproto",
      "libxau"
    ],
    "test": []
  },
  "descriptive": {
    "categories": [],
    "homepage": "https://gitlab.freedesktop.org/xorg/lib/libxext",
    "license": [
      "MIT-open-group",
      "X11",
      "HPND",
      "HPND-sell-variant",
      "HPND-doc-sell",
      "HPND-doc",
      "MIT",
      "ISC"
    ],
    "maintainers": [],
    "summary": "Xlib-based library for common extensions to the X11 protocol"
  },
  "extensions": {
    "merged_from": [
      "nixpkgs"
    ],
    "nixpkgs": {
      "recipe_file": "package.nix"
    }
  },
  "features": {},
  "identity": {
    "canonical_id": "pkg:libxext",
    "canonical_name": "libxext",
    "ecosystem": "nixpkgs",
    "ecosystem_id": "pkgs/by-name/li/libxext",
    "version": "1.3.7"
  },
  "patches": [],
  "platforms": {
    "exclude": [],
    "include": []
  },
  "provenance": {
    "confidence": 0.88,
    "generated_by": "refresh_recipes.py",
    "imported_at": "2026-10-08T04:28:46+00:00",
    "source_path": "pkgs/by-name/li/libxext/package.nix",
    "source_repo_commit": "144baa99f5e19735361b0be3cb11f7d6ef251dcc",
    "unmapped": [
      "license"
    ],
    "warnings": []
  },
  "schema_version": "0.2",
  "sources": [
    {
      "type": "homepage",
      "url": "https://gitlab.freedesktop.org/xorg/lib/libxext"
    },
    {
      "type": "archive",
      "url": "mirror://xorg/individual/lib/libXext-${finalAttrs.version}.tar.xz"
    }
  ],
  "tests": {}
}
