{
  "build": {
    "configure_flags": [],
    "make_flags": [],
    "phases": [
      "configure",
      "build",
      "check",
      "install"
    ],
    "system_kind": "meson"
  },
  "conflicts": [],
  "dependencies": {
    "build": [
      "meson",
      "ninja",
      "pkg-config"
    ],
    "host": [],
    "runtime": [
      "libGLX"
    ],
    "test": []
  },
  "descriptive": {
    "categories": [],
    "homepage": "https://cgit.freedesktop.org/mesa/glu/",
    "license": [
      "sgi"
    ],
    "maintainers": [],
    "summary": "OpenGL utility library"
  },
  "extensions": {
    "merged_from": [
      "nixpkgs"
    ],
    "nixpkgs": {
      "recipe_file": "package.nix"
    }
  },
  "features": {},
  "identity": {
    "canonical_id": "pkg:glu",
    "canonical_name": "glu",
    "ecosystem": "nixpkgs",
    "ecosystem_id": "pkgs/by-name/me/mesa_glu",
    "version": "9.0.3"
  },
  "patches": [],
  "platforms": {
    "exclude": [],
    "include": []
  },
  "provenance": {
    "confidence": 0.95,
    "generated_by": "refresh_recipes.py",
    "imported_at": "2026-10-08T04:28:43+00:00",
    "source_path": "pkgs/by-name/me/mesa_glu/package.nix",
    "source_repo_commit": "144baa99f5e19735361b0be3cb11f7d6ef251dcc",
    "unmapped": [],
    "warnings": []
  },
  "schema_version": "0.2",
  "sources": [
    {
      "type": "homepage",
      "url": "https://cgit.freedesktop.org/mesa/glu/"
    },
    {
      "type": "archive",
      "url": "https://mesa.freedesktop.org/archive/glu/glu-${version}.tar.xz"
    },
    {
      "type": "archive",
      "url": "https://gitlab.freedesktop.org/mesa/glu"
    }
  ],
  "tests": {}
}
