{
  "build": {
    "configure_args": [
      "-DCMAKE_DOC_DIR:STRING=\"${DOCSDIR_REL}\"",
      "-DQHELPGENERATOR_EXECUTABLE=${QT_TOOLDIR}/qhelpgenerator"
    ],
    "make_args": [],
    "system_kind": "cmake",
    "uses": [
      "cmake",
      "python",
      "qt"
    ]
  },
  "conflicts": [],
  "dependencies": {
    "build": [
      "py-sphinx"
    ],
    "host": [
      "bashNonInteractive"
    ],
    "runtime": [],
    "test": []
  },
  "descriptive": {
    "categories": [
      "devel"
    ],
    "deprecated": false,
    "homepage": "https://www.cmake.org",
    "license": [
      "BSD3CLAUSE",
      "BSD-3-Clause"
    ],
    "maintainers": [
      "kde@FreeBSD.org"
    ],
    "summary": "HTML and Qt Creator helpfiles for CMake"
  },
  "extensions": {
    "freebsd_ports": {
      "raw_vars": {
        "CATEGORIES": "devel",
        "PORTNAME": "cmake"
      }
    },
    "merged_from": [
      "freebsd_ports",
      "nixpkgs"
    ],
    "nixpkgs": {
      "recipe_file": "package.nix"
    }
  },
  "features": {},
  "identity": {
    "canonical_id": "pkg:cmake",
    "canonical_name": "cmake",
    "ecosystem": "freebsd_ports",
    "ecosystem_id": "devel/cmake-doc",
    "version": "${_CMAKE_VERSION}"
  },
  "patches": [],
  "platforms": {
    "exclude": [],
    "include": []
  },
  "provenance": {
    "confidence": 0.95,
    "generated_by": "refresh_recipes.py",
    "imported_at": "2026-10-08T04:28:41+00:00",
    "source_path": "devel/cmake-doc",
    "source_paths": [
      "devel/cmake-doc",
      "pkgs/by-name/cm/cmake/package.nix"
    ],
    "source_repo_commit": null,
    "source_repo_commits": [
      "7e6eb47aa71100bc6278d613df0743e2b1ddeaaf",
      "144baa99f5e19735361b0be3cb11f7d6ef251dcc"
    ],
    "unmapped": [],
    "warnings": []
  },
  "schema_version": "0.2",
  "sources": [
    {
      "type": "homepage",
      "url": "https://www.cmake.org"
    },
    {
      "type": "homepage",
      "url": "https://cmake.org/"
    },
    {
      "type": "archive",
      "url": "https://cmake.org/files/v${lib.versions.majorMinor finalAttrs.version}/cmake-${finalAttrs.version}.tar.gz"
    },
    {
      "type": "archive",
      "url": "https://gitlab.kitware.com/cmake/cmake.git"
    }
  ],
  "tests": {}
}
