{
  "build": {
    "configure_args": [],
    "make_args": [],
    "system_kind": "freebsd_ports_make",
    "uses": [
      "cran"
    ]
  },
  "conflicts": [],
  "dependencies": {
    "build": [],
    "host": [
      "png"
    ],
    "runtime": [],
    "test": []
  },
  "descriptive": {
    "categories": [
      "graphics"
    ],
    "deprecated": false,
    "homepage": "https://www.rforge.net/png/",
    "license": [
      "GPLv2+"
    ],
    "maintainers": [
      "tota@FreeBSD.org"
    ],
    "summary": "Read and write PNG images"
  },
  "extensions": {
    "freebsd_ports": {
      "raw_vars": {
        "CATEGORIES": "graphics",
        "PORTNAME": "png"
      }
    },
    "merged_from": [
      "freebsd_ports"
    ]
  },
  "features": {},
  "identity": {
    "canonical_id": "pkg:png",
    "canonical_name": "png",
    "ecosystem": "freebsd_ports",
    "ecosystem_id": "graphics/R-cran-png",
    "version": "0.1-9"
  },
  "patches": [],
  "platforms": {
    "exclude": [],
    "include": []
  },
  "provenance": {
    "confidence": 0.95,
    "generated_by": "refresh_recipes.py",
    "imported_at": "2026-10-08T04:28:48+00:00",
    "source_path": "graphics/R-cran-png",
    "source_repo_commit": "7e6eb47aa71100bc6278d613df0743e2b1ddeaaf",
    "unmapped": [],
    "warnings": []
  },
  "schema_version": "0.2",
  "sources": [
    {
      "type": "homepage",
      "url": "https://www.rforge.net/png/"
    }
  ],
  "tests": {}
}
