{
  "build": {
    "configure_args": [],
    "make_args": [],
    "system_kind": "pypi"
  },
  "conflicts": [],
  "dependencies": {
    "build": [],
    "host": [],
    "runtime": [],
    "test": []
  },
  "descriptive": {
    "categories": [
      "python"
    ],
    "homepage": "https://github.com/certifi/python-certifi",
    "license": [
      "MPL-2.0"
    ],
    "maintainers": [
      "me@kennethreitz.com"
    ],
    "summary": "Python package for providing Mozilla's CA Bundle."
  },
  "extensions": {
    "merged_from": [
      "pypi"
    ],
    "pypi": {
      "build_requirements_state": "unavailable_from_registry_metadata",
      "classifiers": [
        "Development Status :: 5 - Production/Stable",
        "Intended Audience :: Developers",
        "License :: OSI Approved :: Mozilla Public License 2.0 (MPL 2.0)",
        "Natural Language :: English",
        "Programming Language :: Python",
        "Programming Language :: Python :: 3",
        "Programming Language :: Python :: 3 :: Only",
        "Programming Language :: Python :: 3.10",
        "Programming Language :: Python :: 3.11",
        "Programming Language :: Python :: 3.12"
      ],
      "license_expression": "",
      "license_text": "MPL-2.0",
      "requires_dist": [],
      "requires_python": ">=3.7",
      "source_repository": "https://github.com/certifi/python-certifi"
    }
  },
  "features": {},
  "identity": {
    "canonical_id": "pkg:certifi",
    "canonical_name": "certifi",
    "ecosystem": "pypi",
    "ecosystem_id": "certifi",
    "version": "2026.10.19"
  },
  "patches": [],
  "platforms": {
    "exclude": [],
    "include": []
  },
  "provenance": {
    "confidence": 0.9,
    "generated_by": "refresh_recipes.py",
    "imported_at": "2026-10-20T21:29:01+00:00",
    "source_path": "https://pypi.org/pypi/certifi/json",
    "source_repo_commit": null,
    "unmapped": [],
    "warnings": [
      "Build requirements are unavailable from PyPI JSON metadata; no build dependencies inferred."
    ]
  },
  "schema_version": "0.2",
  "sources": [
    {
      "sha256": "035c1e85572b141bf1c3a3eff0e33a8eb74917522f2559075ff8d2fea780a1ae",
      "type": "sdist",
      "url": "https://files.pythonhosted.org/packages/a6/bd/1436c50cc46699de0230fbaacc1d1de7bfec413176099949e9d5112e88f2/certifi-2026.10.19.tar.gz"
    }
  ],
  "tests": {}
}
