{
  "build": {
    "configure_args": [],
    "make_args": [],
    "system_kind": "meson",
    "uses": [
      "compiler",
      "cpe",
      "gnome",
      "meson",
      "pkgconfig",
      "python",
      "shebangfix",
      "tar"
    ]
  },
  "conflicts": [],
  "dependencies": {
    "build": [
      "meson",
      "ninja",
      "libintl",
      "pkg-config",
      "python3",
      "glib",
      "gtk-doc",
      "docbook-xsl-nons",
      "docbook_xml_dtd_43"
    ],
    "host": [
      "harfbuzz",
      "glib",
      "freetype"
    ],
    "runtime": [],
    "test": []
  },
  "descriptive": {
    "categories": [
      "print"
    ],
    "deprecated": false,
    "homepage": "https://harfbuzz.github.io/",
    "license": [
      "MIT"
    ],
    "maintainers": [
      "desktop@FreeBSD.org"
    ],
    "summary": "OpenType text shaping engine"
  },
  "extensions": {
    "freebsd_ports": {
      "raw_vars": {
        "CATEGORIES": "print",
        "PORTNAME": "harfbuzz"
      }
    },
    "merged_from": [
      "freebsd_ports",
      "nixpkgs"
    ],
    "nixpkgs": {
      "recipe_file": "package.nix"
    }
  },
  "features": {
    "options_define": [
      "DOCS"
    ]
  },
  "identity": {
    "canonical_id": "pkg:harfbuzz",
    "canonical_name": "harfbuzz",
    "ecosystem": "freebsd_ports",
    "ecosystem_id": "print/harfbuzz",
    "version": "14.2.1"
  },
  "patches": [],
  "platforms": {
    "exclude": [],
    "include": []
  },
  "provenance": {
    "confidence": 0.95,
    "generated_by": "refresh_recipes.py",
    "imported_at": "2026-10-08T14:14:09+00:00",
    "source_path": "print/harfbuzz",
    "source_paths": [
      "print/harfbuzz",
      "pkgs/by-name/ha/harfbuzz/package.nix"
    ],
    "source_repo_commit": null,
    "source_repo_commits": [
      "e590e1547696a5c9b5c0bf1eeafa8eaf50d4ffd8",
      "58a05315926ecd06da72f932e16d36750591c6ac"
    ],
    "unmapped": [],
    "warnings": []
  },
  "schema_version": "0.2",
  "sources": [
    {
      "type": "homepage",
      "url": "https://harfbuzz.github.io/"
    },
    {
      "type": "master_sites",
      "url": "https://github.com/${PORTNAME}/${PORTNAME}/releases/download/${DISTVERSION}/"
    },
    {
      "type": "archive",
      "url": "https://github.com/harfbuzz/harfbuzz/releases/download/${finalAttrs.version}/harfbuzz-${finalAttrs.version}.tar.xz"
    }
  ],
  "tests": {
    "has_test_target": true
  }
}
