{
  "build": {
    "configure_args": [],
    "make_args": [],
    "system_kind": "cmake",
    "uses": [
      "cmake",
      "compiler",
      "python"
    ]
  },
  "conflicts": [],
  "dependencies": {
    "build": [],
    "host": [],
    "runtime": [],
    "test": []
  },
  "descriptive": {
    "categories": [
      "devel"
    ],
    "deprecated": false,
    "homepage": "https://google.github.io/googletest/  \t\thttps://github.com/google/googletest",
    "license": [
      "BSD3CLAUSE"
    ],
    "maintainers": [
      "sunpoet@FreeBSD.org"
    ],
    "summary": "Framework for writing C++ tests on a variety of platforms"
  },
  "extensions": {
    "freebsd_ports": {
      "raw_vars": {
        "CATEGORIES": "devel",
        "PORTNAME": "googletest"
      }
    },
    "merged_from": [
      "freebsd_ports"
    ]
  },
  "features": {},
  "identity": {
    "canonical_id": "pkg:googletest",
    "canonical_name": "googletest",
    "ecosystem": "freebsd_ports",
    "ecosystem_id": "devel/googletest",
    "version": "1.16.0"
  },
  "patches": [],
  "platforms": {
    "exclude": [],
    "include": []
  },
  "provenance": {
    "confidence": 0.95,
    "generated_by": "refresh_recipes.py",
    "imported_at": "2026-10-08T14:14:09+00:00",
    "source_path": "devel/googletest",
    "source_repo_commit": "e590e1547696a5c9b5c0bf1eeafa8eaf50d4ffd8",
    "unmapped": [],
    "warnings": []
  },
  "schema_version": "0.2",
  "sources": [
    {
      "type": "homepage",
      "url": "https://google.github.io/googletest/  \t\thttps://github.com/google/googletest"
    },
    {
      "type": "master_sites",
      "url": "https://github.com/google/googletest/releases/download/v${PORTVERSION}/"
    }
  ],
  "tests": {
    "has_test_target": true
  }
}
