{
  "build": {
    "configure_args": [],
    "make_args": [],
    "system_kind": "pypi"
  },
  "conflicts": [],
  "dependencies": {
    "build": [
      "setuptools",
      "wheel"
    ],
    "host": [],
    "runtime": [],
    "test": []
  },
  "descriptive": {
    "categories": [
      "python"
    ],
    "homepage": "https://github.com/kurtraschke/pyrfc3339",
    "license": [],
    "maintainers": [
      "Kurt Raschke <kurt@kurtraschke.com>"
    ],
    "summary": "Generate and parse RFC 3339 timestamps"
  },
  "extensions": {
    "pypi": {
      "classifiers": [
        "Development Status :: 5 - Production/Stable",
        "Intended Audience :: Developers",
        "Programming Language :: Python",
        "Programming Language :: Python :: 3",
        "Programming Language :: Python :: 3 :: Only",
        "Programming Language :: Python :: 3.11",
        "Programming Language :: Python :: 3.12",
        "Programming Language :: Python :: 3.13",
        "Programming Language :: Python :: 3.14",
        "Programming Language :: Python :: 3.15"
      ],
      "requires_python": ">=3.11",
      "source_repository": "https://github.com/kurtraschke/pyRFC3339"
    }
  },
  "features": {},
  "identity": {
    "canonical_id": "pkg:pyrfc3339",
    "canonical_name": "pyrfc3339",
    "ecosystem": "pypi",
    "ecosystem_id": "pyRFC3339",
    "version": "2.1.1"
  },
  "patches": [],
  "platforms": {
    "exclude": [],
    "include": []
  },
  "provenance": {
    "confidence": 0.9,
    "generated_by": "bootstrap_canonical_recipes.py",
    "imported_at": "2026-10-20T20:56:36+00:00",
    "source_path": "https://pypi.org/pypi/pyrfc3339/json",
    "source_repo_commit": null,
    "unmapped": [],
    "warnings": []
  },
  "schema_version": "0.2",
  "sources": [
    {
      "sha256": "b144d63819bd4c1ebf9cb57e12f4cba567fcf23d6e8f2f829ba9c7810ea4b951",
      "type": "sdist",
      "url": "https://files.pythonhosted.org/packages/80/7a/0e5227aa1c831fdaf579073a0ebb5ca11fc352a43fce8d2639e3ff87ff74/pyrfc3339-2.1.1.tar.gz"
    }
  ],
  "tests": {}
}
